Keynote,First Name,Last Name,ID,Filename,MIT association,Title,Bio,,,
N,Oded ,Gour-Lavie,N/A,Oded Gour-Lavie.jpg,N,CEO,"Rear Admiral (ret.) Oded Gour-Lavie is the CEO and Co-founder of NT-TAO. Prior to NT-TAO, Oded served in the Israel Defense Forces (IDF) for 30 years, finishing his military career as the Head of the Legal & Strategic Policy Team in the IDF Planning Directorate. Prior to that Oded served as Head of the Sea Division in charge of Naval Operations, Training and Doctrine as well as Commander of the Submarine Force. Oded graduated Cum Laude in Electrical Engineering from the Technion - Israel Institute of Technology and received his MPA from the Harvard Kennedy School of Government, and spent a year as a Visiting Fellow at MIT Sloan School of Management. He is also a father of 5 beautiful children and enjoys hobbies such as bonsai growing, mountain biking and practicing yoga.",,,
N,Sloane,Phillips,N/A,SloanePhillips.jpg,N,VP Data Operations,"Sloane Allebes Phillips is the VP of Data Operations at Iterative Health, a company using AI-technology to improve outcomes in gastroenterology. Sloane is a founding team member of IH and has seen the org grow from a handful of students to ~200 full time employees. 

Sloane has a background in public health, providing her with an understanding of the importance of preventative care for an individual’s quality of life. Prior to Iterative Scopes, Sloane has held positions at Planned Parenthood, in the Peace Corps and at the Women’s World Health Initiative. 

Sloane received her MBA at the Massachusetts Institute of Technology, Sloan School of Management and a B.S. in public health from Brigham Young University.",,,
N,François,Robinet,N/A,FrancoisRobinet.jpg,N,Managing Director of AXA Venture Partners (AVP),"François Robinet is the Managing Partner of AXA Venture Partners (AVP), a €1,3 bln Venture Capital fund dedicated to investing in technology and emerging innovations.",,,